{"$schema":"https://json-schema.org/draft/2020-12/schema","$id":"https://code-review-harness/schemas/human-readiness-action-dossier.schema.json","title":"Authority-Separated Human Readiness Action Dossier","type":"object","additionalProperties":false,"required":["dossier_id","dossier_version","generated_at","readiness_manifest_id","readiness_manifest_hash","entries","summary","dossier_approval_allowed","shadow_scheduled","baseline_unchanged","decision_authority","dossier_hash"],"properties":{"dossier_id":{"type":"string","format":"uuid"},"dossier_version":{"const":"1.0.0"},"generated_at":{"type":"string","format":"date-time"},"readiness_manifest_id":{"type":"string","format":"uuid"},"readiness_manifest_hash":{"$ref":"#/$defs/hash"},"entries":{"type":"array","minItems":1,"items":{"type":"object","additionalProperties":false,"required":["prerequisite_id","required_authority","action_state","packet_type","packet_id","packet_hash","packet_path","response_must_be_atomic","independent_verification_required","satisfies_readiness"],"properties":{"prerequisite_id":{"type":"string"},"required_authority":{"type":"string"},"action_state":{"enum":["awaiting_external_response","not_ready_for_review"]},"packet_type":{"enum":["existing_review_packet","domain_evidence_gap_packet"]},"packet_id":{"type":"string","format":"uuid"},"packet_hash":{"$ref":"#/$defs/hash"},"packet_path":{"type":"string"},"response_must_be_atomic":{"const":true},"independent_verification_required":{"const":true},"satisfies_readiness":{"const":false}}}},"summary":{"type":"object","additionalProperties":false,"required":["total","awaiting_external_response","not_ready_for_review","satisfied"],"properties":{"total":{"type":"integer","minimum":1},"awaiting_external_response":{"type":"integer","minimum":0},"not_ready_for_review":{"type":"integer","minimum":0},"satisfied":{"const":0}}},"dossier_approval_allowed":{"const":false},"shadow_scheduled":{"const":false},"baseline_unchanged":{"const":true},"decision_authority":{"const":"separate_named_human_authority_per_entry"},"dossier_hash":{"$ref":"#/$defs/hash"}},"$defs":{"hash":{"type":"string","pattern":"^sha256:[0-9a-f]{64}$"}}}
